{
  "schema_version": "1.0",
  "node_id": "phoenix",
  "captured_at_utc": "2026-10-19T17:43:57.496697Z",
  "scope": "AI/runtime executable presence, active Python distributions, and dpkg package name/version list",
  "python_executable": "/usr/bin/python3",
  "python_version": "3.12.3",
  "python_packages": [
    {
      "name": "annotated-doc",
      "version": "0.0.5"
    },
    {
      "name": "anyio",
      "version": "4.14.2"
    },
    {
      "name": "appdirs",
      "version": "1.4.4"
    },
    {
      "name": "arena",
      "version": "0.1.0"
    },
    {
      "name": "argcomplete",
      "version": "3.1.4"
    },
    {
      "name": "asttokens",
      "version": "2.4.1"
    },
    {
      "name": "attrs",
      "version": "23.2.0"
    },
    {
      "name": "Babel",
      "version": "2.10.3"
    },
    {
      "name": "bcc",
      "version": "0.29.1"
    },
    {
      "name": "bcrypt",
      "version": "3.2.2"
    },
    {
      "name": "beautifulsoup4",
      "version": "4.12.3"
    },
    {
      "name": "binwalk",
      "version": "2.3.3"
    },
    {
      "name": "blinker",
      "version": "1.7.0"
    },
    {
      "name": "Brlapi",
      "version": "0.8.5"
    },
    {
      "name": "Brotli",
      "version": "1.1.0"
    },
    {
      "name": "cairocffi",
      "version": "1.7.1"
    },
    {
      "name": "CairoSVG",
      "version": "2.9.1"
    },
    {
      "name": "certifi",
      "version": "2023.11.17"
    },
    {
      "name": "cffi",
      "version": "2.1.1"
    },
    {
      "name": "chardet",
      "version": "5.2.0"
    },
    {
      "name": "charset-normalizer",
      "version": "3.5.1"
    },
    {
      "name": "click",
      "version": "8.5.0"
    },
    {
      "name": "click",
      "version": "8.1.6"
    },
    {
      "name": "cloud-init",
      "version": "26.1"
    },
    {
      "name": "colorama",
      "version": "0.4.6"
    },
    {
      "name": "command-not-found",
      "version": "0.3"
    },
    {
      "name": "configobj",
      "version": "5.0.8"
    },
    {
      "name": "contourpy",
      "version": "1.0.7"
    },
    {
      "name": "coverage",
      "version": "7.16.1"
    },
    {
      "name": "cryptography",
      "version": "41.0.7"
    },
    {
      "name": "cryptography",
      "version": "41.0.7"
    },
    {
      "name": "cssselect",
      "version": "1.2.0"
    },
    {
      "name": "cssselect2",
      "version": "0.10.1"
    },
    {
      "name": "cupshelpers",
      "version": "1.0"
    },
    {
      "name": "cycler",
      "version": "0.11.0"
    },
    {
      "name": "dbus-python",
      "version": "1.3.2"
    },
    {
      "name": "decorator",
      "version": "5.1.1"
    },
    {
      "name": "defer",
      "version": "1.0.6"
    },
    {
      "name": "defusedxml",
      "version": "0.7.1"
    },
    {
      "name": "distro",
      "version": "1.9.0"
    },
    {
      "name": "distro-info",
      "version": "1.7+build1"
    },
    {
      "name": "docker",
      "version": "5.0.3"
    },
    {
      "name": "docker-compose",
      "version": "1.29.2"
    },
    {
      "name": "dockerpty",
      "version": "0.4.1"
    },
    {
      "name": "docopt",
      "version": "0.6.2"
    },
    {
      "name": "duplicity",
      "version": "2.1.4"
    },
    {
      "name": "executing",
      "version": "2.0.1"
    },
    {
      "name": "fail2ban",
      "version": "1.0.2"
    },
    {
      "name": "fasteners",
      "version": "0.18"
    },
    {
      "name": "filelock",
      "version": "3.32.3"
    },
    {
      "name": "flatbuffers",
      "version": "25.12.19"
    },
    {
      "name": "fonttools",
      "version": "4.46.0"
    },
    {
      "name": "fpdf2",
      "version": "2.8.4"
    },
    {
      "name": "fs",
      "version": "2.4.16"
    },
    {
      "name": "fsspec",
      "version": "2026.7.0"
    },
    {
      "name": "gguf",
      "version": "0.19.0"
    },
    {
      "name": "gpg",
      "version": "1.18.0"
    },
    {
      "name": "gyp",
      "version": "0.1"
    },
    {
      "name": "h11",
      "version": "0.16.0"
    },
    {
      "name": "hf-xet",
      "version": "1.6.0"
    },
    {
      "name": "html5lib",
      "version": "1.1"
    },
    {
      "name": "httpcore",
      "version": "1.0.9"
    },
    {
      "name": "httplib2",
      "version": "0.20.4"
    },
    {
      "name": "httpx",
      "version": "0.28.1"
    },
    {
      "name": "huggingface_hub",
      "version": "1.29.0"
    },
    {
      "name": "hypothesis",
      "version": "6.168.0"
    },
    {
      "name": "idna",
      "version": "3.6"
    },
    {
      "name": "iniconfig",
      "version": "2.3.0"
    },
    {
      "name": "ipython",
      "version": "8.20.0"
    },
    {
      "name": "jedi",
      "version": "0.19.1"
    },
    {
      "name": "Jinja2",
      "version": "3.1.2"
    },
    {
      "name": "jsonpatch",
      "version": "1.32"
    },
    {
      "name": "jsonpointer",
      "version": "2.0"
    },
    {
      "name": "jsonschema",
      "version": "4.10.3"
    },
    {
      "name": "kiwisolver",
      "version": "0.0.0"
    },
    {
      "name": "language-selector",
      "version": "0.1"
    },
    {
      "name": "launchpadlib",
      "version": "1.11.0"
    },
    {
      "name": "lazr.restfulclient",
      "version": "0.14.6"
    },
    {
      "name": "lazr.uri",
      "version": "1.0.6"
    },
    {
      "name": "louis",
      "version": "3.29.0"
    },
    {
      "name": "lxml",
      "version": "5.2.1"
    },
    {
      "name": "lz4",
      "version": "4.0.2+dfsg"
    },
    {
      "name": "magika",
      "version": "0.6.3"
    },
    {
      "name": "Mako",
      "version": "1.3.2.dev0"
    },
    {
      "name": "Markdown",
      "version": "3.5.2"
    },
    {
      "name": "markdown-it-py",
      "version": "3.0.0"
    },
    {
      "name": "markdownify",
      "version": "1.2.3"
    },
    {
      "name": "markitdown",
      "version": "0.1.7"
    },
    {
      "name": "MarkupSafe",
      "version": "2.1.5"
    },
    {
      "name": "matplotlib",
      "version": "3.6.3"
    },
    {
      "name": "matplotlib-inline",
      "version": "0.1.6"
    },
    {
      "name": "mdurl",
      "version": "0.1.2"
    },
    {
      "name": "monotonic",
      "version": "1.6"
    },
    {
      "name": "mpmath",
      "version": "1.3.0"
    },
    {
      "name": "mpmath",
      "version": "0.0.0"
    },
    {
      "name": "netaddr",
      "version": "0.8.0"
    },
    {
      "name": "netifaces",
      "version": "0.11.0"
    },
    {
      "name": "networkx",
      "version": "3.6.1"
    },
    {
      "name": "numpy",
      "version": "1.26.4"
    },
    {
      "name": "oauthlib",
      "version": "3.2.2"
    },
    {
      "name": "olefile",
      "version": "0.46"
    },
    {
      "name": "onnxruntime",
      "version": "1.29.0"
    },
    {
      "name": "packaging",
      "version": "24.0"
    },
    {
      "name": "paramiko",
      "version": "2.12.0"
    },
    {
      "name": "parso",
      "version": "0.8.3"
    },
    {
      "name": "pdf2image",
      "version": "1.17.0"
    },
    {
      "name": "pexpect",
      "version": "4.9.0"
    },
    {
      "name": "pillow",
      "version": "10.2.0"
    },
    {
      "name": "pip",
      "version": "24.0"
    },
    {
      "name": "pipx",
      "version": "1.4.3"
    },
    {
      "name": "platformdirs",
      "version": "4.2.0"
    },
    {
      "name": "pluggy",
      "version": "1.6.0"
    },
    {
      "name": "prompt-toolkit",
      "version": "3.0.43"
    },
    {
      "name": "protobuf",
      "version": "7.36.1"
    },
    {
      "name": "psutil",
      "version": "5.9.8"
    },
    {
      "name": "ptyprocess",
      "version": "0.7.0"
    },
    {
      "name": "pure-eval",
      "version": "0.0.0"
    },
    {
      "name": "pyasyncore",
      "version": "1.0.2"
    },
    {
      "name": "pycairo",
      "version": "1.25.1"
    },
    {
      "name": "pycparser",
      "version": "3.0"
    },
    {
      "name": "pycups",
      "version": "2.0.1"
    },
    {
      "name": "Pygments",
      "version": "2.17.2"
    },
    {
      "name": "PyGObject",
      "version": "3.48.2"
    },
    {
      "name": "pyinotify",
      "version": "0.9.6"
    },
    {
      "name": "PyJWT",
      "version": "2.7.0"
    },
    {
      "name": "pymupdf",
      "version": "1.28.2"
    },
    {
      "name": "pymupdf-layout",
      "version": "1.28.2"
    },
    {
      "name": "pymupdf4llm",
      "version": "1.28.2"
    },
    {
      "name": "PyNaCl",
      "version": "1.5.0"
    },
    {
      "name": "PyOpenGL",
      "version": "3.1.7"
    },
    {
      "name": "pyparsing",
      "version": "3.1.1"
    },
    {
      "name": "PyQt5",
      "version": "5.15.10"
    },
    {
      "name": "PyQt5-sip",
      "version": "12.13.0"
    },
    {
      "name": "PyQt6",
      "version": "6.6.1"
    },
    {
      "name": "PyQt6-sip",
      "version": "13.6.0"
    },
    {
      "name": "pyqtgraph",
      "version": "0.13.4"
    },
    {
      "name": "pyrsistent",
      "version": "0.20.0"
    },
    {
      "name": "pyserial",
      "version": "3.5"
    },
    {
      "name": "pytest",
      "version": "9.1.1"
    },
    {
      "name": "pytest-cov",
      "version": "7.1.0"
    },
    {
      "name": "python-apt",
      "version": "2.7.7+ubuntu5.3"
    },
    {
      "name": "python-dateutil",
      "version": "2.8.2"
    },
    {
      "name": "python-debian",
      "version": "0.1.49+ubuntu2"
    },
    {
      "name": "python-docx",
      "version": "1.2.0"
    },
    {
      "name": "python-dotenv",
      "version": "1.0.1"
    },
    {
      "name": "python-magic",
      "version": "0.4.27"
    },
    {
      "name": "python-pptx",
      "version": "1.0.2"
    },
    {
      "name": "pytz",
      "version": "2024.1"
    },
    {
      "name": "pyxdg",
      "version": "0.28"
    },
    {
      "name": "PyYAML",